date,content,reliability,clean_content
2020-03-17," The WHO coronavirus test ""was a bad test.""Â		",0,the who coronaviru test bad test â
2020-03-18, With self-checkup you can find out if you are infected with coronavirus.		,0,with self checkup find infect coronaviru
2020-03-18, Countries that are the most affected by the coronavirus are along the same latitude.		,0,countri affect coronaviru along latitud
2020-03-18, There is a Russian medicine that could be use against Sars-Cov-2.		,0,there russian medicin could use sar cov 2
2020-03-18, Trump Is Promising To Send Americans Checks - Only After Checking People's Social Media History.		,0,trump is promis to send american check onli after check peopl social media histori
2020-03-18," If we want to protect ourselves from the coronavirus, we must back away from all the climate change efforts we've been making.		",0,if want protect coronaviru must back away climat chang effort make
2020-03-18, These at-home coronavirus testing kits are real.		,0,these home coronaviru test kit real
2020-03-19, India asked for restriction of movement.		,0,india ask restrict movement
2020-03-19," Press Release on movement restriction for COVID-19 outbreak by National Security Council, PMO (India).		",0,press releas movement restrict covid outbreak nation secur council pmo india
2020-03-19," The parks of Adra, in Spain, are being fumigated with poison.		",0,the park adra spain fumig poison
2020-03-19, The quarantine will last until the end of May in Ukraine.		,0,the quarantin last end may ukrain
2020-03-19, Biden claims that Trump eliminated the White House pandemic office.		,0,biden claim trump elimin white hous pandem offic
2020-03-19, Walmart is closing hundreds of its stores.		,0,walmart close hundr store
2020-03-20," 1720, 1919, 2020... Every hundred years, a pandemia ""cleans""Â the Earth.		",0,everi hundr year pandemia clean â earth
2020-03-20," People shouting ""Allahu Akbar""Â in Europe after the coronavirus outbreak.		",0,peopl shout allahu akbar â europ coronaviru outbreak
2020-03-20, Romania has changed the law so that those who break the quarantine will face 15 years in prison.		,0,romania chang law break quarantin face year prison
2020-03-20, Says truck drivers are being turned away from fast-food restaurants during the COVID-19 pandemic.		,0,say truck driver turn away fast food restaur covid pandem
2020-03-20," ""Wisconsin is the only state where all Republicans voted against protecting its citizens.""Â		",0,wisconsin state republican vote protect citizen â
2020-03-20," The coronavirus Aid, Relief, and Economic Security Act gives members of Congress a pay increase.		",0,the coronaviru aid relief econom secur act give member congress pay increas
2020-03-21," Stocks of ""medical masks""Â made in Woippy, in Moselle, by a company are being blocked for lack of ""agreement of the government,""Â in spite of a shortage of masks in France.		",0,stock medic mask â made woippi mosel compani block lack agreement govern â spite shortag mask franc
2020-03-21, Sophie Trudeau is sharing her COVID-19 experience.		,0,sophi trudeau share covid experi
2020-03-21," ""Only India can resist coronavirus""Â?  Saudi Crown Prince Mohammad Bin Salman.		",0,onli india resist coronaviru â saudi crown princ mohammad bin salman
2020-03-21, This is a self-check test for coronavirus.		,0,thi self check test coronaviru
2020-03-21, The King of Spain has plagiarized his COVID-19 speech from a book.		,0,the king spain plagiar covid speech book
2020-03-21, The schools in Bizkaia in Spain do not close until September.		,0,the school bizkaia spain close septemb
2020-03-21, There are more than 6 000 coronavirus infections in Ukraine. The government hides the real numbers.		,0,there 6 coronaviru infect ukrain the govern hide real number
2020-03-21," If people violate the quarantine measures in Ukraine, they will be imprisoned.		",0,if peopl violat quarantin measur ukrain imprison
2020-03-21, Bill Gates and the Vatican have a plan to depopulate the world with a coronavirus vaccine.		,0,bill gate vatican plan depopul world coronaviru vaccin
2020-03-21, Joe Biden tested positive for coronavirus.		,0,joe biden test posit coronaviru
2020-03-21, Coronavirus cases linked to 5G rollout.		,0,coronaviru case link 5g rollout
2020-03-21, Fill out a 2020 U.S. Census form to receive an economic stimulus payment.		,0,fill u s censu form receiv econom stimulu payment
2020-03-21," Biden campaign claims a top CDC official was ""silenced.""Â		",0,biden campaign claim top cdc offici silenc â
2020-03-22, US military brought the virus to Wuhan on October 2019.		,0,us militari brought viru wuhan octob
2020-03-22, Turkey helped Italy with 200.000 masks and other equipment but nobody took notice.		,0,turkey help itali mask equip nobodi took notic
2020-03-22, Clapping together at 5 p.m. will create a vibration which will destroy coronavirus.		,0,clap togeth 5 p creat vibrat destroy coronaviru
2020-03-22, Initial lack of evidence for human-to-human COVID-19 transmission unusual.		,0,initi lack evid human human covid transmiss unusu
2020-03-22," ""Go to 2020census.gov and fill out this census form so you can get your stimulus check.""Â		",0,go censu gov fill censu form get stimulu check â
2020-03-23," Tests results, theft, ban",0,test result theft ban
2020-03-23, Will lockdown cause a shortage of banknotes in ATMs?		,0,will lockdown caus shortag banknot atm
2020-03-23, COVID-19 patients will not show symptoms for the first 14 days.		,0,covid patient show symptom first day
2020-03-23,"After 23:30, the city will be disinfected by a helicopter and the doors and windows should be closed.",0,after citi disinfect helicopt door window close
2020-03-23, False offer of free Internet during 60 days due to the quarantine.		,0,fals offer free internet day due quarantin
2020-03-23, Whether 60 Democrats voted against coronavirus stimulus bill.		,0,whether democrat vote coronaviru stimulu bill
2020-03-24," In Hong Kong, people destroyed a 5G pole because of coronavirus.		",0,in hong kong peopl destroy 5g pole coronaviru
2020-03-24, Reserve Bank of India (RBI) extended the year closing until 6/30/20.		,0,reserv bank india rbi extend year close 6
2020-03-24," In India starting 3/24/20, all grocery, chemists and vegetable shops will be open from 9.00 am to 11.30 am and 4.30 pm to 7.00 pm. Anybody found moving around after this or opening any kind of outlet will be detained by the police. No home deliveries will be available.		",0,in india start 3 groceri chemist veget shop open 9 4 pm 7 pm anybodi found move around open kind outlet detain polic no home deliveri avail
2020-03-24," A tank circulates through the streets of Tudela, Navarre, Spain, to combat COVID-19.		",0,a tank circul street tudela navarr spain combat covid
2020-03-24," A claim that the Swedish hospitals were going to start using ""death forms""Â to decide which patients to treat and which to send home to die without healthcare.		",0,a claim swedish hospit go start use death form â decid patient treat send home die without healthcar
2020-03-24, The names of coronavirus victims have been published online in media.		,0,the name coronaviru victim publish onlin medium
2020-03-25, A COVID-19 test in Germany is 37 times cheaper than in Croatia.		,0,a covid test germani time cheaper croatia
2020-03-25," In France, the state pays 46 billions a year for its army, but only 1 billion for its inhabitants' health.		",0,in franc state pay billion year armi 1 billion inhabit health
2020-03-25, The internet can crash because of a lockdown.		,0,the internet crash lockdown
2020-03-25," Russia helped Italy which was left alone by its ""partners""Â during the coronavirus crisis.		",0,russia help itali left alon partner â coronaviru crisi
2020-03-25, Ireland is in the first phase of a lockdown sequence.		,0,ireland first phase lockdown sequenc
2020-03-25, COVID-19 is a secret American weapon aimed for depopulation purposes.		,0,covid secret american weapon aim depopul purpos
2020-03-25, The University of Barcelona will approve its students if classes are suspended for more than a month.		,0,the univers barcelona approv student class suspend month
2020-03-25, Leave objects in the sun to avoid contracting the coronavirus.		,0,leav object sun avoid contract coronaviru
2020-03-25," ""if your child gets this virus, they're going to the hospital alone in a van with people they don't know, to be with people they don't know. You will be at home without them in their time of need.""Â		",0,child get viru go hospit alon van peopl know peopl know you home without time need â
2020-03-25, There has been a pandemic every 100 years		,0,there pandem everi year
2020-03-26, Decathlon's snorkeling masks are used in hospitals to help patients' breathing.		,0,decathlon snorkel mask use hospit help patient breath
2020-03-26, There is no space in the hospitals in Italy because people are crowding outside.		,0,there space hospit itali peopl crowd outsid
2020-03-26, Image of a mother unable to feed her suckling as she battles COVID-19.		,0,imag mother unabl feed suckl battl covid
2020-03-26, Demon creature flying above a church in Italy.		,0,demon creatur fli church itali
2020-03-26," A video of a policeman taking down a man wandering during a ""lockdown in Italy.""Â		",0,a video policeman take man wander lockdown itali â
2020-03-26, A drug for coronavirus has been found.		,0,a drug coronaviru found
2020-03-26, 1 out of 3 people who died from coronavirus in Spain lived in a nursing home.		,0,1 3 peopl die coronaviru spain live nurs home
2020-03-26, Chinese doctors recommended in Italy to sing on the balconies for the new coronavirus.		,0,chines doctor recommend itali sing balconi new coronaviru
2020-03-26," The WHO has decreed the ""suspension of any and all medical activities.""Â		",0,the who decre suspens medic activ â
2020-03-27, An emergency department closed in a Spanish hospital.		,0,an emerg depart close spanish hospit
2020-03-27, An online survey to self-assess coronavirus symptoms.		,0,an onlin survey self ass coronaviru symptom
2020-03-27, Biden claims that Trump did not try to get medical experts into China.		,0,biden claim trump tri get medic expert china
2020-03-27, Coronavirus has been found in crab legs.		,0,coronaviru found crab leg
2020-03-27," ""They're furloughing nurses in hospitals in western New York state.""Â		",0,they furlough nurs hospit western new york state â
2020-03-27, Whether countries with high rates of childhood vaccines were hit hardest by coronavirus.		,0,whether countri high rate childhood vaccin hit hardest coronaviru
2020-03-27, NY banned cigarette sales because of the coronavirus.		,0,ny ban cigarett sale coronaviru
2020-03-28," ""Queen Elizabeth tests positive for COVID-19.""Â		",0,queen elizabeth test posit covid â
2020-03-28, Whether CDC had scheduled announcement that all should wear masks for everyday life.		,0,whether cdc schedul announc wear mask everyday life
2020-03-28, If Florida banned alcohol sales due to coronavirus.		,0,if florida ban alcohol sale due coronaviru
2020-03-29, Spanish authorities are not arresting people who attend mass.		,0,spanish author arrest peopl attend mass
2020-03-29," CEOs got advance notice of COVID, then resigned to dump stock.		",0,ceo got advanc notic covid resign dump stock
2020-03-30, Ukraine lost a visa-free regime due to the coronavirus pandemic.		,0,ukrain lost visa free regim due coronaviru pandem
2020-03-30," ""We inherited a broken test""Â for COVID-19.		",0,we inherit broken test â covid
2020-03-30, Big Pharma is behind COVID-19 deaths.		,0,big pharma behind covid death
2020-03-30, Whether microwaving face masks sanitizes them.		,0,whether microwav face mask sanit
2020-03-31, The Houseparty app has been hacked.		,0,the houseparti app hack
2020-03-31, Says there's an 800 number you can call to track the status of your stimulus check.		,0,say number call track statu stimulu check
2020-04-01, Video of empty hospitals is proof that the pandemic is not real.		,0,video empti hospit proof pandem real
2020-04-01, Italians bidding goodbye to the world because of coronavirus.		,0,italian bid goodby world coronaviru
2020-04-02, Beware of food delivery apps in India as they blow into the food before packaging it.		,0,bewar food deliveri app india blow food packag
2020-04-02, Ansa news has reported that former ECB Governor Mario Draghi will lead the Italian task-force against COVID-19.		,0,ansa news report former ecb governor mario draghi lead italian task forc covid
2020-04-02," If Russian people do not obey mandatory isolation, they are imprisoned for five years.		",0,if russian peopl obey mandatori isol imprison five year
2020-04-02, COVID-19 is safe for a healthy population. Medical facilities are overloaded due to panic.		,0,covid safe healthi popul medic facil overload due panic
2020-04-02, McDonald's is reopening in the UK from Monday 6 April.		,0,mcdonald reopen uk monday 6 april
2020-04-02, The new Nightingale Hospital in London wants people to post it home-made art to brighten up the walls.		,0,the new nightingal hospit london want peopl post home made art brighten wall
2020-04-02, Walmart is adopting a staggered schedule due to the coronavirus.		,0,walmart adopt stagger schedul due coronaviru
2020-04-02," Only certain face masks are effective and others, such as cloth masks, are not.		",0,onli certain face mask effect other cloth mask
2020-04-03, Coronavirus is also spread through newspapers.		,0,coronaviru also spread newspap
2020-04-03," In view of the COVID-19 pandemic, the Indian government has extended the financial year from April 1 to July 1.		",0,in view covid pandem indian govern extend financi year april 1 juli 1
2020-04-03, Bitcoin ads that use familiar faces to scam people.		,0,bitcoin ad use familiar face scam peopl
2020-04-03," ""We've got to give the American public a rough estimate of how long we think this is going to take, based mostly on the South Korean model, which seems to be the trajectory that we are on, thankfully, and not the Italian model.""Â		",0,we got give american public rough estim long think go take base mostli south korean model seem trajectori thank italian model â
2020-04-03," ""The Chinese Communist Party is using Zoom as a way to spy on our citizens.""Â		",0,the chines communist parti use zoom way spi citizen â
2020-04-03," Says a study projects Wisconsin's coronavirus cases will peak on April 26, 2020.		",0,say studi project wisconsin coronaviru case peak april
2020-04-03," ""Joe Exotic tests positive for coronavirus in prison. It's been confirmed.""Â		",0,joe exot test posit coronaviru prison it confirm â
2020-04-04," Portugal has officially announced the death of a 14-year-old boy from COVID-19, although he is an athlete and has had no health problems.		",0,portug offici announc death year old boy covid although athlet health problem
2020-04-04, Suggestion that Trump urged sick people to get out and vote during COVID-19 pandemic.		,0,suggest trump urg sick peopl get vote covid pandem
2020-04-05, A decree that allows euthanasia in dependant senior homes has been passed in France.		,0,a decre allow euthanasia depend senior home pass franc
2020-04-05," The contact ban is only for Germans, muslims can still gather and don't have to pay fines in Germany.		",0,the contact ban german muslim still gather pay fine germani
2020-04-05," A statement by Salvador Illa, Minister of Health of Spain, where he affirms that the WHO changed the position on the use of masks.		",0,a statement salvador illa minist health spain affirm who chang posit use mask
2020-04-06, France forces patients of dual nationality to leave its hospitals to be able to treat the French during the COVID-19 outbreak.		,0,franc forc patient dual nation leav hospit abl treat french covid outbreak
2020-04-06, A man in Italy killed himself after he lost his family to the coronavirus.		,0,a man itali kill lost famili coronaviru
2020-04-06," In India, the Congress President's approval is required to use funds from PMNRF.		",0,in india congress presid approv requir use fund pmnrf
2020-04-06," Owing to India lighting diyas on April 5, a satellite captured India as illuminated while the world was in darkness.		",0,owe india light diya april 5 satellit captur india illumin world dark
2020-04-07," This video reveals the manipulation behind COVID-19 pandemics, in order to install a dictatorship order.		",0,thi video reveal manipul behind covid pandem order instal dictatorship order
2020-04-07, Claim that the Polish government is planning to cut on family benefits due to coronavirus.		,0,claim polish govern plan cut famili benefit due coronaviru
2020-04-07, Coronavirus can be spread to animals.		,0,coronaviru spread anim
2020-04-07, Coronavirus can be spread between people and animals.		,0,coronaviru spread peopl anim
2020-04-07, 2 nurses who were in ITU in Swansea have died today. 3 more still ventilated. All from the same unit.		,0,2 nurs itu swansea die today 3 still ventil all unit
2020-04-07, Steam from boiling oranges kills COVID-19.		,0,steam boil orang kill covid
2020-04-07, Coronavirus will be exterminated if lockdowns are lifted.		,0,coronaviru extermin lockdown lift
2020-04-08, Indian government deploying the army in Telangana to curb the coronavirus situation		,0,indian govern deploy armi telangana curb coronaviru situat
2020-04-09, Boris Johnson shopping in England in the time of coronavirus.		,0,bori johnson shop england time coronaviru
2020-04-09," A video of a white car ramming several police cars in Errenteria (Guipuzkoa), Spain.		",0,a video white car ram sever polic car errenteria guipuzkoa spain
2020-04-10, 80% of COVID-19 patients die due to mechanical ventilators.		,0,covid patient die due mechan ventil
2020-04-11, The measles-mumps-rubella vaccine reduces the severity of Covid-19.		,0,the measl mump rubella vaccin reduc sever covid
2020-04-11, 5G is the real cause of the epidemic.		,0,5g real caus epidem
2020-04-11," ""The COVID-19 future vaccine will come with the ID?  a mark. The ID tells everyone you are free of COVID.""Â		",0,the covid futur vaccin come id mark the id tell everyon free covid â
2020-04-12, WHO wants to enter citizens' homes and forcefully deport their children.		,0,who want enter citizen home forc deport child
2020-04-12, A video of the British Prime Minister while shopping from an Arab store after he was struck by COVID-19.		,0,a video british prime minist shop arab store struck covid
2020-04-12," The US $1,200 coronavirus relief checks this year are ""just an advance on your next tax return. ... Next year, you're automatically going to owe $1,200 come tax season.""Â		",0,the us 1 coronaviru relief check year advanc next tax return next year automat go owe 1 come tax season â
2020-04-13, The government takes the opportunity of the epidemy to discreetly develop 5G in France.		,0,the govern take opportun epidemi discreetli develop 5g franc
2020-04-13, COVID-19 case in Bettiah Jail.		,0,covid case bettiah jail
2020-04-13," ""The president looks like he was ahead of the curve - as you know, he talks about this all the time - on shutting down travel from China.""Â		",0,the presid look like ahead curv know talk time shut travel china â
2020-04-14," Numerous countries postponed the re-opening of schools to September 2020, and therefore French decision to re-open them on May 11 is worrying		",0,numer countri postpon open school septemb therefor french decis open may worri
2020-04-14, Lockdown in South Africa has collapsed. People are out on the streets because due to hunger.		,0,lockdown south africa collaps peopl street due hunger
2020-04-15, Packages from China may be infected.		,0,packag china may infect
2020-04-15, All Indians living in the USA on H1-B visa will be deported back to India in 60 days.		,0,all indian live usa h1 b visa deport back india day
2020-04-15, Anti-bacterial mouthwash which has been watered down is an effective substitute for hand sanitiser		,0,anti bacteri mouthwash water effect substitut hand sanitis
2020-04-15, Anyone in Manchester with blood group O negative should go to the Royal Infirmary as they have run out of blood.		,0,anyon manchest blood group o neg go royal infirmari run blood
2020-04-15, COVID-19 is sparing essential workers.		,0,covid spare essenti worker
2020-04-16," The epidemic is stopping in Marseille, one of the French largest cities.		",0,the epidem stop marseil one french largest citi
2020-04-16, Central government rejects Kerala government's appeal to dispatch planes to retrieve Indian expats stuck in Gulf countries.		,0,central govern reject kerala govern appeal dispatch plane retriev indian expat stuck gulf countri
2020-04-16," Due to COVID-19 outbreak, UPSC has cancelled examinations in India.		",0,due covid outbreak upsc cancel examin india
2020-04-16," Says Democrats are on vacation until May 4 and ""refuse to come back""Â to sign a bill to help small businesses.		",0,say democrat vacat may 4 refus come back â sign bill help small busi
2020-04-17, Image of Gulbarga car festival held during lockdown this year.		,0,imag gulbarga car festiv held lockdown year
2020-04-17, Indian Police mistreating positive coronavirus patients.		,0,indian polic mistreat posit coronaviru patient
2020-04-18," Indian Union State Minister for External Affair, V. Muraleedharan says, ""if the expatriates return, they will threaten the lives of resident Indians.""Â		",0,indian union state minist extern affair v muraleedharan say expatri return threaten life resid indian â
2020-04-19, New York schools add a COVID-19 vaccine to the mandatory school schedule.		,0,new york school add covid vaccin mandatori school schedul
2020-04-20," ""Hundreds and hundreds of labs are ready, willing, and able.""Â		",0,hundr hundr lab readi will abl â
2020-04-20," 42 Democratic senators, plus two Independents, voted against sending direct payments to Americans as part of the coronavirus economic stimulus package.		",0,democrat senat plu two independ vote send direct payment american part coronaviru econom stimulu packag
2020-04-21, Russia forgave a 20 billion dollar debt from some African countries due to the coronavirus crisis.		,0,russia forgav billion dollar debt african countri due coronaviru crisi
2020-04-21, Currency spread on the roads to spread coronavirus.		,0,currenc spread road spread coronaviru
2020-04-21," COVID-19 patinet in Kanpur, India left outside the hopsital without any treatment.		",0,covid patinet kanpur india left outsid hopsit without treatment
2020-04-21, Two cyclists from Cordoba skip the quarantine.		,0,two cyclist cordoba skip quarantin
2020-04-21," A chess tournament was held in Kalush, Ukraine during the quarantine.		",0,a chess tournament held kalush ukrain quarantin
2020-04-22, Physical exercise reduces the infection risk by 50%.		,0,physic exercis reduc infect risk
2020-04-22, You should wear the colored side of the mask on the outside when you are sick and the white side on the outside when you are healthy.		,0,you wear color side mask outsid sick white side outsid healthi
2020-04-22," This video shows fishes overflowing out of the water in Goa, India because the fishery business has been halted due to the lockdown.		",0,thi video show fish overflow water goa india fisheri busi halt due lockdown
2020-04-22, A ban on Chinese citizens going to markets in Australia.		,0,a ban chines citizen go market australia
2020-04-22," ""People defying stay-at-home order fill Arizona beaches.""Â		",0,peopl defi stay home order fill arizona beach â
2020-04-23, Serbia has enough coronavirus tests.		,0,serbia enough coronaviru test
2020-04-23, The April 22 jump in COVID-19 cases in the United States was related to the election.		,0,the april jump covid case unit state relat elect
2020-04-24," ""Half the workforce in the country may have just been idled""Â by coronavirus.		",0,half workforc countri may idl â coronaviru
2020-04-24," ""We've still had more deaths to the flu this year than we've had COVID-19.""Â		",0,we still death flu year covid â
2020-04-25, Use of hydroxycholoroquine is restricted to military hospitals in France.		,0,use hydroxycholoroquin restrict militari hospit franc
2020-04-26, The rate of coronavirus-related deaths being reported out of New York City is 200 times higher than the death rates of the world's largest 10 cities.		,0,the rate coronaviru relat death report new york citi time higher death rate world largest citi
2020-04-27, There is a link between Covid-19 and the Kawasaki disease.		,0,there link covid kawasaki diseas
2020-04-27, Spanish and French masks prices are comparable.		,0,spanish french mask price compar
2020-04-27, COVID-19 is a big pharma fraud and a treatment has existed for years now (stem cell therapy).		,0,covid big pharma fraud treatment exist year stem cell therapi
2020-04-27, Images of families breaching the safety distances related to the coronavirus this April 26 in Spain.		,0,imag famili breach safeti distanc relat coronaviru april spain
2020-04-27, McDonald's is reopening in the UK from Monday 27 April.		,0,mcdonald reopen uk monday april
2020-04-27," Hospitals in the United States get paid $750 for patients who die from the flu, $17,500 for COVID-19.		",0,hospit unit state get paid patient die flu covid
2020-04-28," Pragya Kathua, a comedian from Odia, has died.		",0,pragya kathua comedian odia die
2020-04-28, An official government announcement details how COVID-19 restrictions will be eased in Ireland from early May.		,0,an offici govern announc detail covid restrict eas ireland earli may
2020-04-29," Georgia Gov. Brian Kemp ""mandates restaurants reopen""Â.		",0,georgia gov brian kemp mandat restaur reopen â
