date,content,reliability,clean_content
2020-04-03,Europe's north-south lockdown divide revealed by Google data,1,europ north south lockdown divid reveal googl data
2020-04-03,Stamp Duty and Stamp Duty Reserve Tax: transfer schemes of arrangement,1,stamp duti stamp duti reserv tax transfer scheme arrang
2020-04-02,"Mecca, Medina get 24-hour curfew; Gulf migrant worker districts locked down",1,mecca medina get hour curfew gulf migrant worker district lock
2020-04-01,China clamps down on coronavirus test kit exports after accuracy questioned,1,china clamp coronaviru test kit export accuraci question
2020-03-31,River Thames: lock and weir fishing permit application form,1,river thame lock weir fish permit applic form
2020-03-29,New York state coronavirus deaths increase by 237 in past day: governor,1,new york state coronaviru death increas past day governor
2020-03-28,"Canada to block people with COVID-19 symptoms from domestic flights, trains",1,canada block peopl covid symptom domest flight train
2020-03-28,Australia tightens social distancing rules to combat coronavirus,1,australia tighten social distanc rule combat coronaviru
2020-03-27,"In Iraq, coronavirus terrifies even doctors hardened by conflict",1,in iraq coronaviru terrifi even doctor harden conflict
2020-03-25,Exemptions from Devices regulations during the coronavirus (COVID-19) outbreak,1,exempt devic regul coronaviru covid outbreak
2020-03-25,Managing the Flow of Ideas in a Pandemic,1,manag flow idea pandem
2020-03-23,Louis Dreyfus sees food demand holding up in coronavirus crisis,1,loui dreyfu see food demand hold coronaviru crisi
2020-03-23,"CVS to hire 50,000 employees for coronavirus assistance",1,cv hire employe coronaviru assist
2020-03-22,Lockdowns not enough to defeat coronavirus - WHO's Ryan,1,lockdown enough defeat coronaviru who ryan
2020-03-21,RPT-Hong Kong activates only a third of virus quarantine wristbands as thousands return home,1,rpt hong kong activ third viru quarantin wristband thousand return home
2020-03-20,Germans warned: Keep your distance or face a curfew,1,german warn keep distanc face curfew
2020-03-19,"ECB's emergency scheme comes at right time, key to use all tools - Holzmann",1,ecb emerg scheme come right time key use tool holzmann
2020-03-18,"New York City 'almost to point' of recommending 'shelter-in-place' to Governor, NYC Mayor says",1,new york citi almost point recommend shelter place governor nyc mayor say
2020-03-18,British supermarkets impose limits as panic buying spreads,1,british supermarket impos limit panic buy spread
2020-03-16,BioNTech in China alliance with Fosun over coronavirus vaccine candidate,1,biontech china allianc fosun coronaviru vaccin candid
2020-03-15,"France reports 36 more coronavirus deaths, raising total to 127",1,franc report coronaviru death rais total
2020-03-11,False claim: Military tanks are deployed amid prison riots triggered by coronavirus measures in Italy,1,fals claim militari tank deploy amid prison riot trigger coronaviru measur itali
2020-03-11,"UPDATE 2-FirstGroup to sell North American units, not seeing much coronavirus impact",1,updat 2 firstgroup sell north american unit see much coronaviru impact
2020-03-09,Oil collapses after Saudi Arabia fires opening salvo in price war,1,oil collaps saudi arabia fire open salvo price war
2020-03-08,New York City could hit 100 coronavirus cases in two to three weeks: mayor,1,new york citi could hit coronaviru case two three week mayor
2020-03-05,Bethlehem's Church of the Nativity ordered closed over coronavirus fears,1,bethlehem church nativ order close coronaviru fear
2020-03-05,Watson and Wilson back for England against Wales,1,watson wilson back england wale
2020-02-28,Going viral: Six charts and the $6 trillion loss,1,go viral six chart 6 trillion loss
2020-02-28,Hong Kongers turn out for indie club's last performance as coronavirus forces closure,1,hong konger turn indi club last perform coronaviru forc closur
2020-02-27,"Mexico to let cruise ship dock as crew member found to have flu, not coronavirus",1,mexico let cruis ship dock crew member found flu coronaviru
2020-02-15,Belgium coach Martinez hints at Fellaini recall,1,belgium coach martinez hint fellaini recal
2020-02-14,China’s Beijing sets 14-day quarantine rule for arrivals - official daily,1,china beij set day quarantin rule arriv offici daili
2020-01-19,China reports 17 more cases of new virus strain,1,china report case new viru strain
2020-05-31,"As protests rage, Trump will not move to seize control of National Guard troops",1,as protest rage trump move seiz control nation guard troop
2020-05-28,Basketball-Hall delays Bryant's enshrinement ceremony due to COVID-19,1,basketbal hall delay bryant enshrin ceremoni due covid
2020-05-28,Mumbai DJ swaps deck for doctor's scrubs to fight coronavirus,1,mumbai dj swap deck doctor scrub fight coronaviru
2020-05-27,Brent Cross owner Hammerson says CEO to step down,1,brent cross owner hammerson say ceo step
2020-05-26,Novavax launches its first coronavirus vaccine test on humans,1,novavax launch first coronaviru vaccin test human
2020-05-21,FINA postpones 2020 World Swimming Championships to December 2021 due to COVID-19,1,fina postpon world swim championship decemb due covid
2020-05-21,How should I clean and store my face mask?,1,how i clean store face mask
2020-05-21,More than 300 attacks on UK emergency staff prosecuted during COVID-19 lockdown,1,more attack uk emerg staff prosecut covid lockdown
2020-05-21,California to give guidelines for restarting TV and movie production,1,california give guidelin restart tv movi product
2020-05-20,U.S. Department of Justice warns California governor over pandemic church closings,1,u s depart justic warn california governor pandem church close
2020-05-15,UPDATE 1-Credit rating 'fallen angel' danger at record high -S&P Global,1,updat 1 credit rate fallen angel danger record high sp global
2020-05-15,Ethiopian Airlines CEO expects settlement with Boeing by end-June,1,ethiopian airlin ceo expect settlement boe end june
2020-05-12,Russian President Vladimir Putin's spokesman tests positive for coronavirus,1,russian presid vladimir putin spokesman test posit coronaviru
2020-05-12,Coronavirus-hit German economy contracted by up to 25% - KfW,1,coronaviru hit german economi contract kfw
2020-05-07,California predicts $54.3 billion budget deficit due to coronavirus,1,california predict 3 billion budget deficit due coronaviru
2020-05-05,"Peru's president confirms coronavirus caseload now over 50,000",1,peru presid confirm coronaviru caseload
2020-05-04,Fiona Dickie on becoming the Pubs Code Adjudicator,1,fiona dicki becom pub code adjud
2020-05-03,"WHO's Ryan says world is in 'fight of our lives', but there is hope",1,who ryan say world fight life hope
2020-05-01,FDA's lax rules on coronavirus blood tests open U.S. market to dubious vendors,1,fda lax rule coronaviru blood test open u s market dubiou vendor
2020-04-30,"Delta, Frontier to require facial coverings on flights",1,delta frontier requir facial cover flight
2020-04-29,"Barclays CEO says 'putting 7,000 people in a building may be thing of the past'",1,barclay ceo say put 7 peopl build may thing past
2020-04-28,Eat safe: The takeaway on takeout (and other food),1,eat safe the takeaway takeout food
2020-04-28,Students in England encouraged to apply now for student finance,1,student england encourag appli student financ
2020-04-27,"Tap youth talent to tackle COVID-19 crisis and beyond, UN chief tells Security Council",1,tap youth talent tackl covid crisi beyond un chief tell secur council
2020-04-27,Embraer takes Boeing to arbitration over failed deal as shares plummet,1,embraer take boe arbitr fail deal share plummet
2020-04-26,Nigeria's governors seek to make face masks compulsory in public,1,nigeria governor seek make face mask compulsori public
2020-04-26,White House considering replacing HHS chief Azar: reports,1,white hous consid replac hh chief azar report
2020-04-23,Tom Hanks sends typewriter to bullied Australian boy named Corona,1,tom hank send typewrit bulli australian boy name corona
2020-04-22,Germany approves first trial of COVID-19 vaccine candidate,1,germani approv first trial covid vaccin candid
2020-04-22,"Number of coronavirus cases in Poland exceeds 10,000",1,number coronaviru case poland exce
2020-04-20,"Generalized anxiety disorder, depressive symptoms and sleep quality during COVID-19 epidemic in China: a web-based cross-sectional survey: COVID-19/SARS-CoV-2 News from Preprints",1,gener anxieti disord depress symptom sleep qualiti covid epidem china web base cross section survey covid sar cov 2 new preprint
2020-04-17,'We all stay home': no work and no stimulus checks for undocumented family in U.S.,1,we stay home work stimulu check undocu famili u s
2020-04-17,UK's Prince William and Kate say: look after mental health in coronavirus crisis,1,uk princ william kate say look mental health coronaviru crisi
2020-04-15,Sweden's Clas Ohlson says sales reflect people staying more at home,1,sweden cla ohlson say sale reflect peopl stay home
2020-04-15,India permits resumption of some industries in rural areas from April 20,1,india permit resumpt industri rural area april
2020-04-10,He smiled to comfort his COVID-19 patient - then he realized his mask was leaking,1,he smile comfort covid patient realiz mask leak
2020-04-10,"Table tennis: Man v Machine, India's Sathiyan training with robot",1,tabl tenni man v machin india sathiyan train robot
2020-04-10,"Helicopters, fines in Australia's Easter travel crackdown against coronavirus",1,helicopt fine australia easter travel crackdown coronaviru
2020-04-09,New York City hires laborers to bury dead in Hart Island potter's field amid coronavirus surge,1,new york citi hire labor buri dead hart island potter field amid coronaviru surg
2020-04-08,Anaesthetic machines: off-label use during the COVID-19 pandemic (MDA/2020/012),1,anaesthet machin label use covid pandem mda
2020-04-07,Your Money: Make a big impact with your COVID-19 charity dollars,1,your money make big impact covid chariti dollar
2020-04-06,Allstate to return $600 million in auto premiums to customers as pandemic cuts driving,1,allstat return million auto premium custom pandem cut drive
2020-07-29,Extra university places for vital courses announced,1,extra univers place vital cours announc
2020-07-29,Belarus seeks Russian explanation after detaining alleged mercenaries before election,1,belaru seek russian explan detain alleg mercenari elect
2020-07-29,"Desperate Times, Desperate Measures: The Case for RRx-001 in the Treatment of COVID-19",1,desper time desper measur the case rrx treatment covid
2020-07-28,Twitter puts curbs on Donald Trump Jr's account over COVID-19 tweet,1,twitter put curb donald trump jr account covid tweet
2020-07-22,"Archer reveals racist abuse, mental fragility after test ban",1,archer reveal racist abus mental fragil test ban
2020-07-20,Disabled People’s Organisations (DPOs) forum launches this month,1,disabl peopl organis dpo forum launch month
2020-07-15,UPDATE 1-Homebuilder McCarthy & Stone racks up loss as completions fall 44%,1,updat 1 homebuild mccarthi stone rack loss complet fall
2020-07-14,Tokyo enlists nightclub workers for Q&A-style videos to fight coronavirus,1,tokyo enlist nightclub worker qa style video fight coronaviru
2020-07-13,"Researchers at University College London (UCL) Report Findings in COVID-19 (Black, Asian and Minority Ethnic groups in England are at increased risk of death from COVID-19: indirect standardisation of NHS mortality data): Coronavirus - COVID-19",1,research univers colleg london ucl report find covid black asian minor ethnic group england increas risk death covid indirect standardis nh mortal data coronaviru covid
2020-07-13,"Learners today, leaders tomorrow",1,learner today leader tomorrow
2020-07-10,Scientists focus on how immune system T cells fight coronavirus in absence of antibodies,1,scientist focu immun system t cell fight coronaviru absenc antibodi
2020-07-08,Stuart Broad dropped as England bat vs West Indies,1,stuart broad drop england bat v west indi
2020-07-07,Turkey says it detains 276 migrants in smuggling operation,1,turkey say detain migrant smuggl oper
2020-07-02,Lithuania dabbles in crypto-coin as cbanks look for ways to fend off Facebook,1,lithuania dabbl crypto coin cbank look way fend facebook
2020-06-17,Attendance in education and early years settings during the coronavirus (COVID-19) outbreak - 23 March to 18 June 2020,1,attend educ earli year set coronaviru covid outbreak march june
2020-06-14,Djokovic breaks down in tears after hosting Belgrade exhibition,1,djokov break tear host belgrad exhibit
2020-06-14,"On this day: Born June 15, 1992 - Mohamed Salah, Egyptian footballer",1,on day born june moham salah egyptian footbal
2020-06-10,Cross-border European TV merger would make little sense - ProSieben CEO,1,cross border european tv merger would make littl sens prosieben ceo
2020-06-08,"Samsung leader appears in court, awaits decision on whether he'll be jailed again",1,samsung leader appear court await decis whether jail
2020-06-04,Virginia governor orders removal of statue of Civil War General Lee,1,virginia governor order remov statu civil war gener lee
2020-06-03,Lesotho former first lady arrested in murder case,1,lesotho former first ladi arrest murder case
2020-06-02,"Black and Asian people in England more likely to die from COVID-19, says report",1,black asian peopl england like die covid say report
2020-06-01,Fires burn near White House in violent protests,1,fire burn near white hous violent protest
2020-02-08, Coronavirus has been found in broiler chicken.		,0,coronaviru found broiler chicken
2020-02-10, Coronavirus is found in broiler chicken.		,0,coronaviru found broiler chicken
2020-02-10, There is a case of coronavirus in Caserta.		,0,there case coronaviru caserta
2020-02-10, There is a case of coronavirus in Andorra.		,0,there case coronaviru andorra
2020-02-10, A person with coronavirus is in Andorra on 2/10/20.		,0,a person coronaviru andorra 2
2020-02-12, Germans quarantined in La Gomera by the coronavirus leave home isolation without permission.		,0,german quarantin la gomera coronaviru leav home isol without permiss
2020-02-17, Black skin is resistant to coronavirus.		,0,black skin resist coronaviru
2020-02-18, Popping bubble wrap exposes people to coronavirus.		,0,pop bubbl wrap expos peopl coronaviru
2020-02-19, World labs confirm coronavirus was bioengineered.		,0,world lab confirm coronaviru bioengin
2020-02-21," Six coronavirus cases confirmed in Wichita, Kansas.		",0,six coronaviru case confirm wichita kansa
2020-02-24, A Chinese SWAT Team takes down a coronavirus suspect		,0,a chines swat team take coronaviru suspect
2020-02-24," There are two coronavirus cases in Bovalino (Reggio Calabria, Italy).		",0,there two coronaviru case bovalino reggio calabria itali
2020-02-25, Coronavirus was found in horses.		,0,coronaviru found hors
2020-02-25, China needs coronavirus SWAT (special weapons and tactics) police teams to arrest this coronavirus victim.		,0,china need coronaviru swat special weapon tactic polic team arrest coronaviru victim
2020-02-25," In Poland, people who are not insured have to pay for coronavirus testing, so if they can't afford it, they will spread it.		",0,in poland peopl insur pay coronaviru test cannot afford spread
2020-02-26, Face masks are a good protection against the coronavirus.		,0,face mask good protect coronaviru
2020-02-26, School has been suspended in Catalonia until 3/2/20.		,0,school suspend catalonia 3 2
2020-02-26," Two cases are confirmed of coronavirus in Huelva, Andalucia (2/26/20)		",0,two case confirm coronaviru huelva andalucia 2
2020-02-27, The WHO says the coronavirus might be spread by food.		,0,the who say coronaviru might spread food
2020-02-27," ""The blood test for coronavirus costs $3,200.""Â		",0,the blood test coronaviru cost 3 â
2020-02-28, COVID-19 is just a big flu.		,0,covid big flu
2020-02-28, Coronavirus patients in China are caught by officials on a highway.		,0,coronaviru patient china caught offici highway
2020-02-28, Election years in the United States coincide with major disease outbreaks.		,0,elect year unit state coincid major diseas outbreak
2020-02-28," A ""poll finds 38% of Americans say they will not drink Corona beer because of the virus.""Â		",0,a poll find american say drink corona beer viru â
2020-02-29, Pangolin is the original cause of COVID-19.		,0,pangolin origin caus covid
2020-03-01," ""Florida hospital reports a coronavirus 'infestation' with multiple confirmed patients.""Â		",0,florida hospit report coronaviru infest multipl confirm patient â
2020-03-01," ""Shands Hospital of Gainesville, Florida, has confirmed its first case of coronavirus.""Â		",0,shand hospit gainesvil florida confirm first case coronaviru â
2020-03-02," Man critical with novel coronavirus in Barhalganj, India.		",0,man critic novel coronaviru barhalganj india
2020-03-03, Ads are selling masks protecting against COVID-19.		,0,ad sell mask protect covid
2020-03-03, A bovine vaccine can be used to inoculate people against coronavirus.		,0,a bovin vaccin use inocul peopl coronaviru
2020-03-04, Rapper Eminem contacted coronavirus.		,0,rapper eminem contact coronaviru
2020-03-04, The first coronavirus case in North Macedonia was a well-known fashion designer.		,0,the first coronaviru case north macedonia well known fashion design
2020-03-05, Does France underestimate the outbreak?		,0,doe franc underestim outbreak
2020-03-05, Article says that the Vatican confirmed that the Pope and two assistants have coronavirus.		,0,articl say vatican confirm pope two assist coronaviru
2020-03-05, No work in several regions of Spain due to coronavirus.		,0,no work sever region spain due coronaviru
2020-03-05, Novel coronavirus has a 99.7% survival rate.		,0,novel coronaviru 7 surviv rate
2020-03-05," The coronavirus test costs $3,200.		",0,the coronaviru test cost 3
2020-03-06, 38 % of Americans won't buy Corona beer due to the coronavirus.		,0,american buy corona beer due coronaviru
2020-03-06, Pope Francis contacted coronavirus.		,0,pope franci contact coronaviru
2020-03-06," Bloggers say Nancy Pelosi delayed coronavirus funding so ""Dems could campaign on it.""Â		",0,blogger say nanci pelosi delay coronaviru fund dem could campaign â
2020-03-07, People can't use the right of withdrawal at work because of the outbreak.		,0,peopl cannot use right withdraw work outbreak
2020-03-07, Did the coronavirus mutate and became more aggressive?		,0,did coronaviru mutat becam aggress
2020-03-07, Coronavirus patients are being caught on highways in China.		,0,coronaviru patient caught highway china
2020-03-07," As of 3/7/20, Tanzania and Zambia had confirmed fist cases of the new coronavirus.		",0,as 3 7 tanzania zambia confirm fist case new coronaviru
2020-03-08, 5G is accelerating the spread of the new coronavirus.		,0,5g acceler spread new coronaviru
2020-03-08, States are imposing mandatory leave and statewise school closures due to coronavirus.		,0,state impos mandatori leav statewis school closur due coronaviru
2020-03-09, Hundreds of Italian families are running away from the virus to Africa.		,0,hundr italian famili run away viru africa
2020-03-09, The bill for a coronavirus test in the US is 3.000$.		,0,the bill coronaviru test us 3
2020-03-09, This Lysol disinfectant against coronavirus shows the virus is not new.		,0,thi lysol disinfect coronaviru show viru new
2020-03-09, A doctor named Lupita Yamamoto Lupercio found the coronavirus vaccine.		,0,a doctor name lupita yamamoto lupercio found coronaviru vaccin
2020-03-09," Says 80% of novel coronavirus cases are ""mild.""Â		",0,say novel coronaviru case mild â
2020-03-09," Hand sanitizer will ""do nothing for the coronavirus.""Â		",0,hand sanit noth coronaviru â
2020-03-09," ""Coronavirus?  22. Clintons?  39.""Â		",0,coronaviru clinton â
2020-03-10," The head of Coordinated Emergences, Fernando Simon, has said that is better to get coronavirus now, because later there will be no space in hospitals.		",0,the head coordin emerg fernando simon said better get coronaviru later space hospit
2020-03-10, A coronavirus vaccine for cows shows that the virus behind the current outbreak is not new.		,0,a coronaviru vaccin cow show viru behind current outbreak new
2020-03-11, Retirement benefits reduced by 50% in April in Italy.		,0,retir benefit reduc april itali
2020-03-11, Seven ambulance workers are infected with coronavirus in Catalonia.		,0,seven ambul worker infect coronaviru catalonia
2020-03-11, Coronavirus found in toilet paper.		,0,coronaviru found toilet paper
2020-03-12," A worker at the Prince hotel in Mehdipatnam (Hyderbad, India) has tested positive for coronavirus.		",0,a worker princ hotel mehdipatnam hyderbad india test posit coronaviru
2020-03-12, Tuit reports that Brazilian president Jair Bolsonaro has tested positive for the coronavirus.		,0,tuit report brazilian presid jair bolsonaro test posit coronaviru
2020-03-12, Spain ex-King Juan Carlos I has the coronavirus.		,0,spain ex king juan carlo i coronaviru
2020-03-12," Live stream about the infected foreigners coming to Ukraine from Italy, which went viral.		",0,live stream infect foreign come ukrain itali went viral
2020-03-12, Of the Trump administration's European travel restrictions that exempt the U.K.,0,of trump administr european travel restrict exempt u k
2020-03-12, The U.S. presidential election is canceled due to coronavirus.		,0,the u s presidenti elect cancel due coronaviru
2020-03-12," If you donate blood, ""they HAVE to test you""Â for coronavirus.		",0,if donat blood have test â coronaviru
2020-03-12," ""The CDC can detain anyone with a fever indefinitely. Vaccination (is) a way people could get out of detention.""Â		",0,the cdc detain anyon fever indefinit vaccin way peopl could get detent â
2020-03-13, The coronavirus outbreak is over in China.		,0,the coronaviru outbreak china
2020-03-13, People are panicked about a COVID-19 case at the Dakar Airport.		,0,peopl panick covid case dakar airport
2020-03-13, COVID-19 Breeds Rapidly In Toilet Paper.		,0,covid breed rapidli in toilet paper
2020-03-13, The health service in Ireland is asking people to stockpile food.		,0,the health servic ireland ask peopl stockpil food
2020-03-13, Sex helps prevent coronavirus.		,0,sex help prevent coronaviru
2020-03-13," A misleading chart being spread on Facebook, erroneously dubbing the new coronavirus the ""least deadly virus.""Â		",0,a mislead chart spread facebook erron dub new coronaviru least deadli viru â
2020-03-13, Man did pass along coronavirus infection at a WalMart in Louisiana.		,0,man pa along coronaviru infect walmart louisiana
2020-03-13, NYC did implement a citywide quarantine.		,0,nyc implement citywid quarantin
2020-03-13," In South Florida ""all children and adults must remain in their homes""Â due to coronavirus.		",0,in south florida child adult must remain home â due coronaviru
2020-03-13," Says The New York Times exposed the ""real reason behind coronavirus hype",0,say the new york time expos real reason behind coronaviru hype
2020-03-14, Ireland is going into a full lockdown.		,0,ireland go full lockdown
2020-03-14, Catalonia universities give all course credits to its students after classes being suspended.		,0,catalonia univers give cours credit student class suspend
2020-03-14, CEO Resignations Are Linked To Global Conspiracy.		,0,ceo resign are link to global conspiraci
2020-03-14, Coronavirus is found in crab legs.		,0,coronaviru found crab leg
2020-03-14, Article overstates threat of coronavirus.		,0,articl overst threat coronaviru
2020-03-15, Dettol is an effective disinfectant for COVID-19.		,0,dettol effect disinfect covid
2020-03-15, Quarantine may last for several years.		,0,quarantin may last sever year
2020-03-15, Pandemics happen every 100 years.		,0,pandem happen everi year
2020-03-15, The quarantine will last until the end of May in Ukraine.		,0,the quarantin last end may ukrain
2020-03-15," ""So Oscar Health, the company tapped by Trump to profit from covid tests, is a Kushner company. Imagine that, profits over national safety.""Â		",0,so oscar health compani tap trump profit covid test kushner compani imagin profit nation safeti â
2020-03-15, The novel coronavirus is not new.		,0,the novel coronaviru new
2020-03-16, An official decree taken by the government says the military will have to help in the hospitals.		,0,an offici decre taken govern say militari help hospit
2020-03-16, Dallas student celebrating spring break collapses from coronavirus.		,0,dalla student celebr spring break collaps coronaviru
2020-03-16, Coronavirus is the least deadly virus.		,0,coronaviru least deadli viru
2020-03-16, CDC warns people that morel mushroom increases coronavirus risk by 200%.		,0,cdc warn peopl morel mushroom increas coronaviru risk
2020-03-17, The military is coming to Paris because of the coronavirus.		,0,the militari come pari coronaviru
2020-03-17, Another rumor claims the military is coming to Paris because of the coronavirus.		,0,anoth rumor claim militari come pari coronaviru
2020-03-17, Although Germany closes its borders refugees and migrants may still come in and they will not be medically checked for coronavirus.		,0,although germani close border refuge migrant may still come medic check coronaviru
2020-03-17, The internet will collapse globally due to the new coronavirus outbreak.		,0,the internet collaps global due new coronaviru outbreak
2020-03-17, Here are the measures that Mercadona will implement due to the coronavirus crisis.		,0,here measur mercadona implement due coronaviru crisi
2020-03-17," In Ukraine, utility bills are deferred for two months due to the quarantine.		",0,in ukrain util bill defer two month due quarantin
