date,content,reliability,clean_content
2020-04-30, WHO's stance on coronavirus is changing and now supports the Swedish opening policies.		,0,who stanc coronaviru chang support swedish open polici
2020-05-01," Kentucky teachers will conduct in-home ""bedroom inspections""Â during the week of April 27 for their kindergarten through eighth grade students.		",0,kentucki teacher conduct home bedroom inspect â week april kindergarten eighth grade student
2020-05-01," ""93% of the (COVID-19) cases in the state of Illinois have come from Chicago.""Â		",0,covid case state illinoi come chicago â
2020-05-02, Golf courses are reopening in Ireland on 2nd May.		,0,golf cours reopen ireland 2nd may
2020-05-02, New WHO guidelines recommend encouraging children under four to masturbate.		,0,new who guidelin recommend encourag child four masturb
2020-05-02, Liechtenstein introduces mandatory biometric bracelets to track COVID-19 pandemic.		,0,liechtenstein introduc mandatori biometr bracelet track covid pandem
2020-05-02," Gas is under $1 in 13 states, but $2.27 in Pennsylvania, because of the governor.		",0,ga 1 state 2 pennsylvania governor
2020-05-03, 5 millions euros were unlocked in order to save Cannes film festival canceled due to COVID-19.		,0,5 million euro unlock order save cann film festiv cancel due covid
2020-05-03,"Trump: Medically, we had empty cupboards. The cupboards  I say, the cupboards were empty.",0,trump medic empti cupboard the cupboard i say cupboard empti
2020-05-03," Regarding the risks of coronavirus transmission on an airplane, ""It's as safe as an environment as you're going to find.""Â		",0,regard risk coronaviru transmiss airplan it safe environ go find â
2020-05-04, Trump campaign video suggesting Trump's travel restrictions on China saved 2 million lives.		,0,trump campaign video suggest trump travel restrict china save 2 million life
2020-05-05, US Defense Secretary Mark Esper let slip that 5G could be destructive and it has something to do with pandemic.		,0,us defens secretari mark esper let slip 5g could destruct someth pandem
2020-05-05, The British Army is setting up a military camp at the site of a former infamous prison in Northern Ireland as part of the effort to fight coronavirus.		,0,the british armi set militari camp site former infam prison northern ireland part effort fight coronaviru
2020-05-05," ""Trump bailed out Wall Street, but not Main Street.""Â		",0,trump bail wall street main street â
2020-05-05," Models projecting COVID-19 deaths ""are talking about without mitigation.""Â		",0,model project covid death talk without mitig â
2020-05-06, More than half the people in Flanders have no faith in government communication on the coronavirus crisis.		,0,more half peopl flander faith govern commun coronaviru crisi
2020-05-06," $3 trillion for federal coronavirus stimulus packages is ""being borrowed basically from China.""Â		",0,3 trillion feder coronaviru stimulu packag borrow basic china â
2020-05-07," ""States like New York, Illinois and California have been vocal in their demands for funding to bail out their pension systems, which were failing long before the COVID-19 outbreak, and other programs that aren't related to this crisis.""Â		",0,state like new york illinoi california vocal demand fund bail pension system fail long covid outbreak program relat crisi â
2020-05-07," ""Since the reopening of (the state of Georgia), we've seen our COVID rate skyrocket by 40%.""Â		",0,sinc reopen state georgia seen covid rate skyrocket â
2020-05-08, Mass SARS-Cov-2 testing does more harm than good.		,0,mass sar cov 2 test harm good
2020-05-11, Coronavirus outbreak is due to 5G.		,0,coronaviru outbreak due 5g
2020-05-11," ""Germany and the United States are the two best in deaths per 100,000 people, which, frankly, to me, that's perhaps the most important number there is.""Â		",0,germani unit state two best death per peopl frankli perhap import number â
2020-05-13," Minister of finance praises Latvia's COVID-19 state support for private business, saying that because of that the unemployment rate has risen much less than in the neighboring countries.		",0,minist financ prais latvia covid state support privat busi say unemploy rate risen much le neighbor countri
2020-05-13," If COVID-19 was a serious illness, it would have wiped out the homeless population in the U.S.		",0,if covid seriou ill would wipe homeless popul u s
2020-05-14, All employees of PNB Loni branch found coronavirus positive.		,0,all employe pnb loni branch found coronaviru posit
2020-05-14, The Spanish Police acts to sanction citizens on the street for carrying a Spanish flag or for protesting against the Government with a saucepan.		,0,the spanish polic act sanction citizen street carri spanish flag protest govern saucepan
2020-05-14, Research proves that commercial mouthwash could protect against COVID-19.		,0,research prof commerci mouthwash could protect covid
2020-05-15, Leader of Polish ruling party PiS Jaroslaw Kaczynski is planning to legalize marijuana due to coronavirus economic crisis.		,0,leader polish rule parti pi jaroslaw kaczynski plan legal marijuana due coronaviru econom crisi
2020-05-18," Texas and Florida have a ""balanced budget""Â while California is ""in debt $54 billion and New York is ""in debt $6.1 billion.""Â		",0,texa florida balanc budget â california debt billion new york debt 6 1 billion â
2020-05-18," ""While California is dying ... Gavin (Newsom) is vacationing in Stevensville, MT!""Â		",0,while california die gavin newsom vacat stevensvil mt â
2020-05-19, The survival rate for COVID-19 is 98.54% in the UK.		,0,the surviv rate covid uk
2020-05-20, The first test results for the Moderna vaccine are disappointing.		,0,the first test result moderna vaccin disappoint
2020-05-22, Sloth bear seen in a house garden in Sri Lanka during the COVID-19 lockdown.		,0,sloth bear seen hous garden sri lanka covid lockdown
2020-05-26," Says the state ""health secretary says don't go to hospitals or clinics, now the tourism secretary says don't recreate.""Â		",0,say state health secretari say go hospit clinic tourism secretari say recreat â
2020-05-29," An article states that Moderna found a vaccine for Covid-19, and it will produce a billion doses by December.		",0,an articl state moderna found vaccin covid produc billion do decemb
2020-06-01, COVID-19 is not new and an old textbook gives out its treatment.		,0,covid new old textbook give treatment
2020-06-07, Nanochips were found in COVID-19 vaccines.		,0,nanochip found covid vaccin
2020-06-08, Healthcare workers in this video turn their backs when the WHO director appears		,0,healthcar worker video turn back who director appear
2020-06-13, Facebook is using your pictures and posts in lawsuits against it amid COVID-19 pandemic.		,0,facebook use pictur post lawsuit amid covid pandem
2020-06-14," ""George Floyd's 'murder' filmed before COVID-19.""Â		",0,georg floyd murder film covid â
2020-06-15, The vaccine is not the final solution against the novel coronavirus.		,0,the vaccin final solut novel coronaviru
2020-06-15," News stories referencing the number ""322""Â and COVID-19 are proof cases tolls are being ""synchronized""Â.		",0,new stori referenc number â covid proof case toll synchron â
2020-06-16, Facebook is using your pictures and posts in lawsuits against the company amid the COVID-19 pandemic.		,0,facebook use pictur post lawsuit compani amid covid pandem
2020-06-17, This video of the Eiffel Tower shows a tribute to victims of Covid-19.		,0,thi video eiffel tower show tribut victim covid
